{
  "id": "g-pred-1",
  "run": 1,
  "text_hash": "sha256:1e4044b6e1c79125",
  "status": "ok",
  "error": null,
  "tags": [
    { "name": "Context-dependent", "decision": "do_not_apply", "p": 0.05, "rule_ref": "Context-dependent rule 1", "rule_hash": null, "trigger": null, "reason": "No pronoun or definite phrase without an antecedent.", "basis": "model" },
    { "name": "Hypothetical", "decision": "do_not_apply", "p": 0.04, "rule_ref": "Hypothetical rule 1", "rule_hash": null, "trigger": null, "reason": "The claim is flat, not conditional.", "basis": "model" },
    { "name": "Predictive", "decision": "apply", "p": 0.93, "rule_ref": "Predictive rule 1", "rule_hash": "sha256:702a438ec960b460", "trigger": "will", "reason": "An unconditional forecast marker: will.", "basis": "model" },
    { "name": "Source inaccessible", "decision": "do_not_apply", "p": null, "rule_ref": "no sources", "rule_hash": null, "trigger": null, "reason": "The claim has no sources, so none is inaccessible.", "basis": "no_source_text" },
    { "name": "Unsourced", "decision": "apply", "p": 1, "rule_ref": "sources count 0", "rule_hash": null, "trigger": null, "reason": "Computed from the sources count.", "basis": "deterministic" }
  ],
  "config": {
    "driver": "fake",
    "model": "claude-sonnet-5-5",
    "effort": "medium",
    "rubric_version": "2026-10-13.1",
    "rubric_hash": "sha256:28b66bc9fa168ef5",
    "scope_hash": "sha256:df5e64168deb5185",
    "prompt_version": "sha256:0123456789abcdef",
    "cli_version": null,
    "config_id": "sha256:aaaaaaaaaaaaaaaa"
  },
  "call": { "batch": "b1", "attempt": 1, "duration_ms": 1200, "cost_usd": null }
}
